{
  "operationID": "example",
  "op": "test",
  "path": {
    "pointer": "/system/state",
    "tokens": [],
    "pointsToMissing": true,
    "pointsToNull": true
  },
  "preconditionHash": "example",
  "diagnosticReference": {
    "diagnosticID": "example",
    "chainRootReference": "example",
    "diagnosticKind": "STATE_VALIDITY",
    "ruleReferences": [
      {
        "ruleID": "ASH-STATE-VALIDITY-001",
        "sourceReference": "example",
        "ruleFamily": "example"
      }
    ]
  }
}
